content,label
"Jahannya mantap, jahitannya RapiKualitas bahan sangat baik????. Berfungsi dengan baik.",Positive
"bagus produknya, fast delivery. thank you seller ^^",Positive
"Agak kecewa, pesan biru atau hitam datang yg warna merah",Negative
Saat diterima kotak sudah kebuka. Ada 1 botol yang gak ada tutupnya,Negative
Saat unit ada masalah seller bersedia membantu mengatasi. Terima kasih banyak.,Positive
"mantap pengiriman cepat dan amanah sesuai dengan note yang di tulis , terima kasih kaka",Positive
"Barang bagus, tapi estimasi tiba dilokasi tidak sesuai di aplikasi. Semoga pelayanannya dapat ditingkatkan",Negative
"Nggak sesuai yg diiklanin, airnya loyo...",Negative
Teksturnya creamy. Gampang dipakai. Packaging aman ??.,Positive
pakingnya kurang aman. di pakein dus tipis doang. pdahal elektronik dg barang riskan pecah kalo di tumpuk brng lain,Negative
Pembelian yg kesekian kali disini ????,Positive
Mantap keren. Cuma harus colok listrik kalau mau pakai fitur always-on. Kalau pake batre (AAA 3biji) harus dipencet dulu baru nyala,Positive
ketahanan wangi tidak seperti claim yg di sebutkan 12jam,Negative
"lumayan lah, buat pemanasan",Positive
"pengirimannya sangat lama, belum dikirim statusnya dibuat sudah dikirim. adminnya balasnya template kecewa sekali belanja di official store",Negative
"dikirim tidak sesuai pesanan, proses lama sekali.",Negative
joss produknya.. toko respon cepat,Positive
Sepatu nya sudah sampai..cuma tdk sesuai pesanan sy..seharus nya 40 (1)..41 (3) dan 42 (1) tapi dikasihnya 40 (2) dan 41 (3)..jdi ada yg ga muat dipakai nya...seharusny ada pemberitahuan dlu..lain kali lebih teliti lagi gan..klo untuk kwalitas nya bagus..hanya disayangkan masalah nomer nya aja..,Negative
"Harganya ok banget + dpt cashback lagi! Very fast response, ga ada kendala check in. Mantap!",Positive
"real pict, pengiriman cepat, pengemasan rapi . worth it lah hrga segitu. pasti next order",Positive
"parah banget sih responnya, komplain barang kurang, disuruh via wa, sudah wa disuruh lagi lewat marketplace, ampun dah, sejelek ini pelayanan sekelas OFFICIAL UNILEVER",Negative
"Paket mulus sampai di tujuan, toko juga sudah terpercaya. Mantab??",Positive
Thanks gan paket udah mendarat dengan selamat...pelayanan ok mantab..super fast respon..top very recomended seller,Positive
barang sesuai diskripsi... kulit muka jd bersih lembut d halus... rekomen bwt cowok mantabs,Positive
bgs bgt. anak2 suka sekali. terimakasih,Positive
"produk bagus. harga ramah dompet.panjang tongkat 100cm ada 2 sisi, satu untuk menggosok kotoran di kaca, satu sisi lagi untuk menyapu semua kotoran",Positive
"Overall puas, cuman sayang salah kirim warna",Positive
lampu nya nyala... tapi Bentar aja tahan nya... habis itu mati... terus di colon lagi hidup... Trus Bentar aja mati... ngak tau salahnya dimana...,Negative
buruk super duper buruk kok bisa rusakk dlm nya ini pasti di banting2 sama JNE heran udah di bilang pake YESS YESS malah REG 15 sedia in yess dong tokopedia heran saya,Negative
Terima kasih sudah dibookingkan di sini. Pengalamannya baik semua. Lancar dan dapat kamar bagus.,Positive
Produk original ??. Nyaman dipakai ??.,Positive
"cepet bgt sampai, packing termat sangat aman dan TDK bocor, bubble wrap tebellll sekali, blm dicoba semoga bermanfaat dengan baik",Positive
"pesen playdogh 3, dikirim cuma 1, pesen stamp tp ga dikirim..padahal byr full..ga ada cfm sama sekali..sangat ga rekomended tokonya (maaf sy ksh bintang 1, lain kali hrs lebih amanah kl jual)",Negative
"barang aman diterima, yg paling seneng wanginya enak banget ??",Positive
"Pesan 4 box yang disegel plastik hanya 1 buah, yang 3 lain tidak ada segel. Ini apa maksudnya ya kenapa dibedakan seperti ini? Bagaimana higenitas masker ini?",Negative
kecewa. kok brg rusak dikirim. di chat lama responnya sampai batas waktu otomatis habis. padahal sdh langganan lama ditoko ini..,Negative
"Barang sudah sampai dan ikannya masih sehat dan selamat,makasih",Positive
cepat pengirimannya..packing aman,Positive
Untuk pengatur besar topinya dari plastik dan gampang putus,Negative
"Seller Tidak jujur. saya beli 2 macam barang, salah satu stok kosong tp tidak diinfokan. Tapi lgsg kirim yg satunya. pdhl sudah nunggu2. pikir penyelesaian gampang ya, buyer bisa tinggal minta refund. tapi saya rugi waktu dan ongkir.",Negative
sangat kecewa dengan pelayanan nya,Negative
"beli baru, tapi kok kacamatanya kotor dan usang...",Negative
"yang motif ada yg Cacat ...minta 2 motif dikasih 1 dan polos 3 kwalitas kurang bagus, maklum barang china masih bagus buatan lokal",Negative
"Bagus, berkualitas, sesuai gbr. Makasih Seller, Tokped dan Kurir",Positive
"sudah kesekian kali saya belanja produk atalon, sangat puas. pengirima cepat, produk original bahannya pun nyaman di pakai. pokoknya recommended buat pecinta olahraga lari dll...Produk original ??. Dijamin Termurah. Nyaman dipakai ??.",Positive
"sy pernah usaha jd sy tdk mau menjelekan usaha org, sya toleransi klo pertama beli colokan rusak sy anggap kurir, tpi transaksi ke-2 ini lampu 2dari 3 hanya nyala setengah, bagaimana admin jualan tidak cek dulu sebelum pac d kirim. jujur saya kecewa, saya beli barang mungkin murah tapi bukan yg rusak donk.. cukup terakhir kali belanja di toko ini ????",Negative
"produk sesuai deskripsi, sdh diterima aman, tks",Positive
"enak kartunya, sesuai ekspektasi, plastik beneran. licin . dan kerasa bakal awet",Positive
barang datang tidak lengkap. yidak akan pernah belanja lagi di toko remi loreal,Negative
"official store sih bener, tapi begitu banyak komplen tentang packing, tetep masih di abaikan, berhubung barang nya Ok, ya masih ada yg mau beli, tolong para ATASAN perushaan ini, perhatikan bagian packingnya, jangan cuman asal packing,",Negative
"diluar ekspetasi banget, sambelnya gak seger, agak bau, gada pedes2nya malah manis, packaging nya sih bagus",Negative
"pas, bermanfaat jadi rapi dapurnya.",Positive
respon dan barang di proses dengan cepat thx kyou!! recommended banget.!!,Positive
"barang bagus dan berkualitas, admin ramah dan jujur top pokoknya",Positive
"barang sampai dengan selamat, cakep juga modelnya, dan tidak pernah kecewa dengan produk eiger",Positive
"produk sesuai, pengiriman cepat. harganya 1ribu pas flash sale. oke banget.",Positive
official tapi lama banget...,Negative
"barang 1 minggu baru nyampe,,, itu pun saya harus 2x ke JNE Pedati urusin baru barang sampai..... evaluasi bos! biar nggk gini lagi. cape, ribet urusinnya,,,,nggk dpt apa2",Negative
uda pembelian ke2 nihh,Positive
"sudah saya terima barangnya gan, makasi...",Positive
"Packing tdk ada, sudah tau pengiriman jauh tp tdk dilapisi pelindung. Sisi2 sudut barang rusak",Negative
FIX BUKAN 90YARD TERNYATA TEBALNYA HANYA 9 mm TIPIS BOSS GAK SESUAI JUDUL!!!,Negative
"hadiah gak di kirim , toko offical tapi gak amanah , kapok dah",Negative
Jadi semangat mancing.,Positive
Beneran waterproof. Bulu mata jadi lentik. Proses pesanan cepat. Packaging aman ??. Nggak menggumpal. Gampang dibersihkan. Packaging rapi.,Positive
"Kuasnya kurang bagus, terlalu tebal.",Negative
"sudah terima packingnya rapi, bahannya lembut, enak dipake, kurir yg selalu ramah, mkshPotongannya rapi.",Positive
"Berat, ngga tajam, buat potong daun aja ngga bisa,",Negative
Bau bgt kayak bau sampah,Negative
"lain kali sebelum kirim barang di cek dulu.. berfungsi atau tidak.. pertama dinamo ny tidak ada yaa walaupun seller kirim dinamo nya tapii tetep tidak berfungsi motor nya.. lampu, musik, tombol, dan mesin ny gk nyala.. udh di ces berhari ttep ajh gk mau nyala..",Negative
the best banget dan pengiriman juga cepat,Positive
BELI TAPI PAKETAN DATANG G DIKASIH  PENYOK DAH,Negative
"pesanan ga lengkap, chat ga di bales. toko bagus karyawannya rusak. buat jelek citra jadinya, amal deh.",Negative
"Barang sesuai pesanan dan pengiriman cepat, terima kasih yaa :)",Positive
"kecewa deh ... order warna hitam & navy, dikirim dua2nya warna navy. Alhamdulillah, ga langsung beli banyak, nyoba beli sedikit dulu.",Negative
puas mantap luar biasa cepat sampai rekomendasi belanja disini,Positive
"barangnya jelek banget, ada lubang yg posisinya gak presisi, malah jd gk bisa dimasukin bautnya, aneh, padahal",Negative
"Tidak layak packing nya. bubblenya banyak yang kempes, sepertinya bekas pakai.",Negative
chat tidak dibalas pengiriman baru diproses ketika masa aktif sdah habis kacaw??,Negative
pengiriman express...burungnya lincah banget..top markotop...,Positive
Kirim Cepat Barang Ori Paking Rapi,Positive
barang dah sampe suka banget sama barang nya kurir juga ramah ??,Positive
Material Produk Bagus. Kualitas Produk Bagus. Produk Original. Ukuran Produk Sesuai. Overall recomended ??????Thx so much ???? ??,Positive
Kualitas bahan tinggi ??. Packing aman ??. Dijamin Termurah. Produk nyaman & mudah dipakai.,Positive
"Bahan bagus sih, tapi warna foto sm asli beda",Positive
"aftersalesnya parah. penjual ga baca chat dan ga bales lg, janji tinggal janji",Negative
barang tipis tdk sesuai yang dibilang tebal kapok belanja disini,Negative
"barang jelek, baru juga mau di pake udah gosong, segel udh kebuka,",Negative
Bulu mata jadi lentik. Packaging rapi. Packaging aman ??. Proses pesanan cepat. Aplikator mudah dipakai.,Positive
"mantap, barang oke",Positive
baru dipakai 2 kali dah metong,Negative
Proses barang sampe pengirimanmya lamaaa,Negative
"Harga murah, tapi fisik yang di terima gaa sesuai harapan, lampu di gagang gaa berfungsi, zoom besar kecil gaa berfungsi, lebih parah lagi, saya udah kasih waktu 3 jam untuk jawab keluhan saya via chat, tapi seller slow-slow aja, padahal online.. Utamain kepuasan pelanggan, jangan hanya nyari keuntungan semata, gaa bakal berkah..",Negative
barang datang dalam kondisi rusak parah.lcd pecah.,Negative
"seneng liat mukenanya dtg, tp jd sedih lihat tasnya, tas rusak kok dijual",Negative
"Harga murah, respon penjual cepat dan ramah. Makin sukses ya.. trims",Positive
bukunya bagus dan harganya bersahabat banget bisa buat nambah perbendaharaan cerita si kecil,Positive
"Berat 1 foam hanya 100 gram, tapi ditulis 600 gram, jika beli 10 foam, maka secara data 6 kg, tapi secara timbang fisik hanya 1kg, ini cara yg curang dari penjual utk dpt uang lebih dari ongkir yg pembeli bayarkan.",Negative
"Awalnya saya memberikan rating bagus karena pada pertama kali diffuser menyala dengan baik. Saya menerima produk tanggal 15 Februari 2022, dan langsung saya coba, hasilnya bagus. Lalu saya ikuti petunjuk mematikan dan pembersihannya. Produk ini saya nyalakan kembali hari ini tanggal 21 Februari 2022 (kedua kali) mist sudah tidak keluar dan tombol on tidak menyala. Saya mengajukan komplain di chat dan balasan dari pihak uchii mengatakan produk yang sudah lebih dari 3 hari tidak dapat dikomplain. Sangat disayangkan karena ini produk elektronik. Jawaban lainnya dari pihak uchii juga sangat tidak proffesional. Apakah karena saya membeli pada saat diskon, lalu dikirimkan produk yang sudah rusak. Harusnya lebih bertanggung jawab. Kalau tidak ada penggantian, minimal perbaikan.",Negative
Pengiriman Barang cepat dan sesuai spec barang,Positive
"besi tebal, sesuai deskripsi & foto",Positive
barang cet sampai thanks seller fast respon nya,Positive
gak ad solusi.. !! semoga uang ny berkah ya mba..,Negative
Barang cepat sampai. Kualitas bagus dan pengiriman aman tidak ada yang pecah. Manstapu ??????,Positive
"bahan tipis, jahitan y kasar, pokok y sy k cewa",Negative
kecewa bawa tidak sesuai pesanan pesan 10 yg datang cuma 8 botol,Negative
"Lehernya patah, seller nya ga bisa ganti rugi. Gatau di cek dulu apa ngga sebelum di kirim",Negative
barang dah lama.. benyek benyek.. ada kerusakan ga diganti... pengemasan buruk... harap menjadi pelajaran...,Negative
"Pake seminggu udh rusak, bahannya ada sambungan yang brudul ga bisa dijahit ulang . waktu dtg masih rapi .kecewa......",Negative
respon cepat. barang sesuai deskripsi. busa cukup tebal. semoga awet.,Positive
"seller luar biasa.. packing baik, pengiriman cepat, penting nya barang sesuai deskripsi dan berfungsi. terima kasih..",Positive
lubang nya jelek bgt,Negative
"saya kecewa , sudah sering banget beli disini tapi packingan nya rusak . bolong bolong kayak dimakan tikus . ga mungkin banget kalau ini pecah dijalan . bisa minta retur ga soalnya ga layak banget",Negative
udah langganan,Positive
"tiba tiba patah, dasar baut patah, ane lem aja, moga masih bisa terpakai... mo di balikin rugi di ongkir, terima nasib aja",Negative
"kurang bagus buat kamera mirrorless, masih goyang goyang",Negative
"Cepatt sampainya, barang asli, dan adminnya ramah",Positive
"roll diambil 1/4. Nampak dari potongan sudah mencong mencong. Jualan yang benar, jangan hanya ingin untungnya saja",Negative
puas bangat obat nya fres n cepet sampe paking ok tq,Positive
"pesan tanggal 2 Maret jam 9 pakai pengiriman instant, sampai nya tanggal 3 maret. Padahal sudah bayar mahal, dikirimnya keesokan harinya. bukan salah pengantarnya, driver go-send nya sudah mengantarkan paket dengan baik. tapi durasi proses dari toko sangat lama. padahal butuhnya tanggal 2 maret makanya saya pilih pengiriman instant. saya juga sudah tanya pihak toko jika paket bisa dikirim hari itu juga atau tidak, jawabannya bisa. Tapi kenyataannya paket saya tidak dikirim pada hari itu juga. kalau tidak bisa dikirim hari itu juga ya bilang. Saya juga sudah ajukan cancel pesanan juga tidak ada respon dari penjual. Pelayanan sangat sangat buruk. Tidak recommended. Semoga lebih baik lagi kedepannya.",Negative
barang bagus..cuma kurang teliti saat pengiriman.kabel charger salah yang magnetik tapi dapat kabel charger usb..selain it ok lah,Positive
mantapppp fast delivery !!!! langganan trs tiap bulan ????????,Positive
Pengiriman Lama!,Negative
"pengiriman cepat, packaging hanya satu lapisan, warna tidak sesuai pesanan tapi no problem",Positive
lem nya kurang merekat,Negative
Barang yg dibeli sama sekali tdk berfungsi. Utk komplain hrs ada video unboxing (pdhal bukan kerusakan fisik). Beli dari official store ternyata sama sekali tdk menjamin kualitas barang.,Negative
"Packaging rapi, barang sesuai pesanan & ekspektasi. Bahannya lembut, ringan, jahitannya rapi, dan warnanya cantik",Positive
Saya puas barangnya bagus sampai saat tidak ada masalah,Positive
respon cepat terimakasih,Positive
barang sesuai pesanan..udh di coba oke...packing rapih..mksh..,Positive
Respon Seller CUKUP BAIK. Proses Pengiriman BAIK. Kurir Pengiriman CEPAT. Produk untuk stock semoga cocok pakai,Positive
"cat nya mantap, pengirimannya cepet. ??????",Positive
"packingan aman dan rapi..barangnya bagus..makasi oxihom,tokopedia dan j&t express..",Positive
Terimakasih paketnya sudah saya terima.... sukses terus ya,Positive
"pesanan sebelumnya barang diterima keadaan baik, tapi pesanan sekarang kemasan sudah robek dan bolong.",Negative
Berfungsi dengan baik.,Positive
bahannya bagus. Adem,Positive
"untuk kalian yang beli buat windows 10 saya saranin jangan, karena saya coba di windows 10 mencet mencet sendiri terus padahal stik ps2 saya masih baru, dan di coba di ps2 baik baik saja",Negative
"mantap barang ori, packing oke, harga promo muraj, sering sering aja promo ya",Positive
"Barang sesuai, Terima kasih",Positive
Tdk dpt hadiah,Negative
"thankyou, sesuai pesanan, pengemasan jg cepat...",Positive
Barang yg saya pesan tidak sesuai pesanan. Udah komunikasi via chat untuk minta tukar dan minta tolong direspon ke tokopedia care tapi ga ada balesan sama sekali. Pertama kali saya ngalamin kyk begini selama belanja di toped.,Negative
pengiriman cepat. product Aman. dicoba bisa charge. cm gak terlalu fast charging,Positive
selang nya bolong ada 2 titik. harusnya sebelum kirim di cek dulu.,Negative
harganya murah kualitas barangnya keren abis..gak nyesel dah belinya,Positive
Sudah pake rutin 1 bulan g ada hasil. Payah,Negative
barang bagus. pengirim cepat. s3moga bermanfaat,Positive
Sekali pakai,Negative
"pengiriman cepat, buku sampai dengan selamat, keadaan buku baik baik saja, buku tidak ada cacat dan kekurangan",Positive
sablonan tidak bagus..klo dicuci nempel,Negative
"Gak sesuai gambar, sudah benyek, kemasan plastiknya polos gk ada print 3mnya sesuai gambar",Negative
tidak berfungsi untuk aki normal padahal baru beli langsung di cas LED indikator nya ngga jalan,Negative
Tidak suka dengan respon yg tidak bagus banget,Negative
harga segini kurang worth it.bahan tidak tebal. ada yang lebih murah detail dan bahan lebih baik. sorry,Negative
"Produk sgt biasa..jauh bgt bedanya sm foto dgn realnya..pknya resleting biasa, bahan kasar.",Negative
sangat kecewa banget,Negative
Barangnya original ??. Gampang dipakai. Ada garansi resmi. Penjualnya ramah banget.,Positive
"Alhamdulillah untuk barang sangat sangat bagus, sudah beli 2 kali. pesanan di proses dengan sangat cepat??????????????????????????????????????????",Positive
"Pengantaran tepat waktu, packaging rapih, barang juga dalam kondisi bagus.",Positive
"barang original,aseli dan aman",Positive
baru dibuka tapi bentulnya aneh. kaya udah meleleh tapi dibekuin sendiri padahal baru buka dari pengiriman,Negative
"pengiriman cepat. barangnya kurang oke, tutupnya ga menutup rapat di satu sisi.",Negative
"udh 2x beli disini, seperti biasa pelayanannya puas banget, ???? bakal jadi pelanggan setia sepertinya wkwk",Positive
Barang nya ok.. cuma proses kirim nya agak lama dan admin nya harus nya dichat dulu baru di proses barang nya.,Positive
barang ga sesuai sama permintaan. pdhl udh chat dl an untuk memastikan pesenan motif dan adh di ok in. tp .alah yg dtg tdk sesuain.,Negative
"Seller menggapangkan dan menyepelekan pembeli. Pengiriman lama, pelayanan tidak memuaskan. Seller bilang �wajar lah lama dikirim, kan barang diskon� Sudah lama dikirim, pas di pick up gagal pick up, tidak di follow up lg sama seller. Sampai saya complain baru di kerjain untuk kirim. Kualitas barang, standar. Intinya saya bisa beli dimana saja barang sejenis. Tp sangat menyesal berhubungan dengan seller seperti ini.",Negative
barang cepat sampai dlm keadaan baik,Positive
"pesenan sesuai, packing paket aman seller baik, pengiriman cepat, recommended tksh seller",Positive
mantaaaaaaaaaaap produk original... pokoknya recomended seller,Positive
gak bisa untuk semua merek keyboard,Negative
"untuk kualitas ternyata sama dengan merk China lain 1080p juga yang harga nya 300rb an, bahkan lebih bagus merk lain di 600rb an. lalu untuk pengiriman lambat sekali dari official store, pesan tgl 27, sampai tgl 1, sehingga saya tdk sempat menggunakan pada zoom meeting dan harus memakai hp. cukup kecewa dengan produk dan pelayanan Logitech. kalau utk keyboard nya dan mouse nya emang cukup bagus bbrp model nya, tapi sy kapok beli disini karena barang akan hanya di proses bbrp jam sblm pembatalan walaupun pesan nya di hari biasa.",Negative
"Negative bgt botol nya, jadi gak praktis tumpah2 gitu kaya bocor, liat review emang masalahnya di botol, ehh ternyata bener, paraaaah sih menurut aku botolnya, oil nya lumayan lah",Negative
"Saran aja buat temen temen yang beli disini , jangan buang box nya simpan terus biar kalo baru beli terus rusak bisa di claim garansinya,",Negative
kualitas barang jelek.penguncinya sudah patah saat baru dibuka..,Negative
"Kartunya berfungsi baik, kualitas printing dan kartunya juga bagus. Cuma kalau mau buat collectible card agak kurang di design. Designnya cm croping dari yg udah ada jadi proporsinya kurang bagus. Yang keluaran baru (monster hunter stories 2) malah cropping dari foto blister figur amiibo yg asli jadi msh keliatan ada blister nya sama lobang gantungannya",Positive
rusak 3 pcs gak bisa pakai karena packing asal,Negative
maaf saya kasih bintang 1 katanya barang udha dicek. aktual sampe saya rusak??,Negative
Packagingnya rapi dan aman. Harganya ok dan bagus sesuai dekripsi.,Positive
"ernyata tebel bangat.. pengiriman cepat, packing aman, kualitas barang oke.. kereenn banget.. thanx",Positive
baru pakai di resleting depan langsung rusak gambar bagian belakang kotor,Negative
"kainnya adem, lembut, tipis nyaman lah klo buat tidur terimakasih",Positive
"SANGAT REKOMENDED , PACKING BUBBLE WARP BANYAK MESKIPUN ORDER SEHARGA CEBANN , NICEEE",Positive
keras nya bukan main kayk batu,Negative
"Fast respon, pengiriman cepat",Positive
"Barangnya sudah sampai dan diterima dengan baik, sudah dicoba dan berfungsi dengan baik, cocok untuk ambil barang dibawah tidak perlu menunduk dan jepitnya lumayan kuat, semoga awet barangnya",Positive
"Cepat meresap. packaging baik tidak bocor, pengiriman jg cepat, beli karena ntn live di tokped, thanks seller",Positive
"Serbaguna dan tajam,Barang sesuai deskripsi. Recommended seller tentunya! ????",Positive
hancurrrr. agak keras dan rasanya sudah lama,Negative
"Barang gampang rusak,jarumnya lepas terlempar",Negative
"barang sampai ada yg pecah, bekas di tambal..",Negative
"Karung baru bkn bekas,tipis... ga sesuai gambar.... kapok belanja lg",Negative
Jkt - bdg cmn butuh waktu semalem packing nya mntp pack nya rapi kgak d lecet suara nya enak bet buat rekaman Fingerstyle akustik gatau dah mntp pokoknya,Positive
"Airnya segar dan tekanannya pas. Foto sesuai barang. Worth it banget 60ribu, memang layak jadi no 1 terlaris",Positive
Tidak dikirim lilin nya padahal sdh beli,Negative
keras gak ada rasa,Negative
produk sesuai deskripsi. Recommended ????,Positive
pelayanan mengecewakan,Negative
"Great service, pelayanannya super cepat dan memuaskan semua yg saya tanyakan dijelaskan dengan sabar dan jelas",Positive
"Respon cepet, ramah, solutif, kerjaan cepet banget, harga kompetitif Kerenn recommended seller",Positive
"Penjualnya cukup baik, namun untuk berikutnya tolong dibungkus dengan kardus supaya aman dan diberikan tanda bahwa paketnya dilarang ditimpah dan dijemur berlebihan mengingat isinya itu film kamera :)",Positive
saya kasih bintang 2 dulu soalnya analog atau yang bulet Kanannya itu longgar dan agak ke atas,Negative
warnanya ga sesuai photo di deskripsi warna sepatu di deskripsi aga' crem yang dateng abu2x gelap,Negative
barang sampai dengan aman,Positive
"Pengiriman cepat. Harganya murah. Kualitas oke. Masih diplastik. Ini saya foto setelah dikeluarin dari plastik pembungkusnya. Kainnya lembut dan berukuran kecil, jadi mudah dibawa ke mana-mana.",Positive
"Kainnya gk tipis, standar tebal batik biasa, adem , lembut, variant yg dikirim penjual , sesuai.",Positive
"barang bagus, sesuai harga. Pengiriman cepat, pesen malem pas paginya sampe",Positive
"Koneksi perangkat susah, kalaupun konek seringkali putus, buku petunjuk minim info. Pdhal beli pilihan yg paling mahal. Apa saya saja yg terima barang spt ini?",Negative
Barang pesan 3 kg dikirim 1kg brengsek,Negative
"Suka, jilbabnya bagus+nyaman dipake??????",Positive
Sesuai deskripsi� seller gercep & interaktif� rekomended �,Positive
Bagus barangnya udah berkali kali beli di sini,Positive
ternyata ukurannya kecil di bawah harapan,Negative
Bubble wrap mana bukunya jadi kena benturan :(,Negative
"dabest lah pokokmya, pengiriman ke lampung cuma 3 hari. prosesnya jg gercep banget! Puas teruuuus, ngga pernah kecewa sm original source dari dulu, mantap??",Positive
"Tulisannya 64gb tapi isinya cuma 8gb,,, disuruh di cek... kagak di cek,, cape dweh..",Negative
Tidak pas. Terlalu longgar membuat Nintendo Switch teroyak - oyak di dalam pouch,Negative
BOCORR isinya,Negative
"Yg dipesan & yg dtg barangnya beda, ga ada konfirmasi, mau retur juga mahal di ongkos, Sudah lah",Negative
"Harga affordable, respon seller cepat langsung kirim. Warna sesuai dan cat ga ngapur. Mantab",Positive
Tipis banget dan talinya beneran sekendor itu tapi tali ga masalah si yang penting ketebalannua. Ini sama aja tebelnya kaya masker yg wrna biru/ijo itu. Awalnya baca komen ga percaya soalnya evo lumayan mereknya. Ternyata beneran tipis bngt.,Negative
"Pengiriman cepat dan aman. Barang sesuai deskripsi. Bagian ujungnya terbuat dari plastik, tapi cukup kokoh. Perakitan mudah, cuma modal obeng. Tips: Jangan dikencengin dulu semua bautnya, kecuali kalau sudah fixed dgn ukuran kaki mesin cuci. Recommended. ????",Positive
"kecewa sekali ada 10 lembar warnanya beda memang sekilas bentuk dan motif sama tpi saat mau dipasang beda sekali, rate barang 8/10 rate penjual 4/10",Negative
"Packing seadanya, bubble hanya selapis saja ditambah lapisan plastik, hasilnya barang diterima dalam keadaan patah.",Negative
"kainnya tebel, murah dan manfaat utk menutup latar belakang ketika zoom meeting. pengiriman juga cepat. makasih",Positive
"trima kasih yah, berfungsi dgn sangat baik. Produk nyaman & mudah dipakai. Packing aman ??. Kualitas bahan tinggi ??. Dijamin Termurah.",Positive
"Barang Bagus, pengemasan Aman, dapat Berfungsi dengan Baik",Positive
di foto bonus foto besar... Dateng nya kecill.. pencitraan sekali anda kill sungguh mengecewakan,Negative
Proses pesanan cepat. Packaging aman ??. Packaging rapi.,Positive
Alhamdulillah bagus Material Produk Bagus. Produk Sesuai. Produk Berfungsi Dengan Baik.,Positive
"Lampunya sering error padahal terhubung ke wifi, saklar hidup tapi dihidupin di hp gak mau nyala",Negative
"Ada parts yg kurang, sdh dicomplain & jelaskan di chat tp respon nya kurang coperative",Negative
Barang tidak pernah sampai... malah disuruh ngambil sendiri... ngga rekomen banget,Negative
"SANGAT KECEWA ..!!! INI REAL YG SAYA ALAMI ... SILAHKAN BACA CHAT SAYA DGN SELLER INI SEBELUM MEMBELI, BARANG DIKIRIM TIDAK SESUAI PESANAN, SUDAH DIRETUR, TAPI CERDIKNYA SELLER TIDAK MENGIRIMKAN PESANAN SAYA YG SEHARUSNYA SAYA PESAN.. SUDAH 15 HARIII LHOO GUYS..UANG TIDAK KEMBALI, BARANG PUN TIDAK SAMPAI.. HAHA..SILAHKAN SAJA JIKA SELLER SANGGUP BAWA KE AKHIRAT.. SEMOGA KALIAN TIDAK TERTIPU SEPERTI SAYA..",Negative
