content,label
"Kualitas karung kurang bagus, pengiriman lama.",Negative
Pelatuk kurang bagus. Sudah tidak mau nyala sekarang,Negative
"KALI INI BELANJA DISINI SANGAT MENGECEWAKAN!!! FREE ONGKIR, BIASANYA DIKIRIM DNG SI CEPAT REGULER. Tapi KALI INI DIKIRIMNYA DENGAN SI CEPAT HALU !!!KARDUS PENYOK,TERBUKA, BERANTAKAN !!!! SANGAT BURUK DAN JENIS DELIVERY TIDAK SESUAI DENGAN YG ADA DIAPLIKASI !!!",Negative
mksh paket dah sampai dengan cepat bahannya bagus saya suka??,Positive
menyesaalllll ternyata bahan sama aja dengan yang harga 30rb ??,Negative
bagus banget gas Torch flame gunnya dan penjualnya juga fast respon dan pengirimannya juga cepat. Produk Original. Packaging Bagus. Produk berfungsi dengan baik.,Positive
bocor payahlah ga di periksa dulu,Negative
lumayan bahannya dan harganya murah,Positive
"Barang yg dikirim ga ada remote nya, ga lg belanja disini, toko kurang teliti�",Negative
Barang nya kw!!! Lengket sangat lemah beda dengan 3M ori,Negative
"Buruk, parah, lama pengirimannya.Masak dikasih sarung tangan latex bekas. ????????????????????????????????????????????????????????????",Negative
Tidak pengaruh,Negative
cepet pengiriman nya....bahannya lumayan tebel.. mudah2an nyerap keringet,Positive
ini buat kado loh. masa dusnya hancur seperti ini.,Negative
"kecewa belanja di tempat kamu, lain di pesan lain dikirim ??????",Negative
ukurannya ada yg besar ada yg kecil tapi lumayan dengan harga segitu makasih ya??,Positive
saya beli item ini tetapi pompa elektrik ini tidak bisa di charge. sehingga tidak bisa di pakai. pihak penjual tidak ada respon ! tidak bisa membantu ! saya sangat kecewa. NOT RECOMENDDED !!,Negative
packing sangat aman . selalu puas thx seller sukses,Positive
"mantab sesuai pesanan, respon cukup sigap, dan cukup informatif package rapih aman, kondisi barang bagus segel, sempat kendala gosend error jd baru besoknya hari sabtu di proses, sigap bantu proses cepat akhirnya bs diantar sabtu juga. thanks",Positive
"Salah satu unitnya kedip2, harus di ketok2 dlu baru nyala, ntar kedip2 lagi, malahan gak nyala harus di ketok2 lg lampunya... satu unitnya lagi perfect tidak ada masalah.. thanks",Negative
barang sudah sampai??,Positive
"packaging gk aman bgt, bubble wrap tipis alhasil kemasan barang agak penyok pas dateng, thank god barangnya aman. ini official store seharusnya lebih baik lagi, fix min next duh.",Negative
"pengiriman cepat, packing rapi, kualitas mantap",Positive
"pengiriman lama, lokasi toko saya di jakarta, ternyata di kirim dari yogyakarta",Negative
saya tidak terima barangnya sama sekali. padahal gojek instan. entah salah gojek apa toko. yang jelas saya udah komplain tapi by sistem diubah akhirnya dana diteruskan ke penjual. ANEH!! setelah dibantu tokopedia care akhirnya ketahuan salah kirim ke rumah orang lain. dan masih dalam proses pengecekan.,Negative
"Pengiriman lambat, seminggu baru sampai. Bagi yang membutuhkan cepat, lebih baik beli di supermarket langsung",Negative
puas..??????,Positive
"pdhl beli tanggla 25,bilang ada souvenir,ternyata dtg cm susu nya doank.aaa payah",Negative
"sering disconnect, kadang tidak berfungsi autocatch",Negative
"Tutup retak sehingga saat diterima, sudah lepas dari markernya. Marker jadi kering. Kecewa banget.",Negative
"Aduk Ka.kenapa ya makin ke sini pengiriman barang nya makin jelek..barang banyak yg keriput, kusut, rusak.. tolong dong ke depannya di perbaiki",Negative
"PRODUK BAGUS, PROSES SANGAT CEPAT, PENJUAL RAMAH DAN DESAIN BAGUS, KAMI AKAN PESAN LAGI",Positive
"Respon seller sangat cepat dan ramah, packing sangat rapih... RECOMMENDED SELLER lah pokok nya !!!!",Positive
mic tdk berfungsi dgn baik / rusak gak bunyi,Negative
Admin super responsif.cartridge berfungsi dengan baik.sayang bgt cuma bisa ngasih 5 bintang,Positive
"thank you utk saran2nya anabul ku kebantu banget sama produk ini, bakal repurchase lg nih",Positive
Paking oke bagus. Mohon perbaikan. Stik bergetar terus tanpa henti. mesin agak sering hang mau ganti game. Mohon diperbaiki gan. Selisih ongkir juga. Trims.,Negative
"isinya cuma 800 gr, diskripsinya 1 kg.. udah terlanjur beli 10 bungkus.. tolong dong jangan suka nipu alus model gini.. kagak berkah tau!! parah nih sellernya, ngasih duit haram ke keluarganya..",Negative
"Lucuu bangett.. Pengirimannya cepat, sellernya responsif banget.. Subuh2 di chat jg dijawab soalnya aku liat ini uda dr malam banget sih.. Kirain bakal baru dijawab agak siang.. Trnyata subuh uda dijawab?? informatif banget.. Ngsh tau klo dikasih oil agak berkabut.. Kirain bakal lbh berkabut dr ini.. Trnyata kabutnya cm kyk difoto.. Seneng deh.. Lampunya jg terang klo di tmpt gelap ?? makasihh yaa",Positive
Baru sehari udh basi T_T,Negative
"pia nya sudah sampai kak, tp pas di buka pada hancur smua. padahal sudah di bubble wrap",Negative
Pesanan sdh diterima dlm keadaan baik dan fast respond dr seller mantap,Positive
"kartunya kw semua,katanya ori gimana sih",Negative
"Pesan 3 buah XXXL ukuran lingkar dada 52 cm, yg datang 43, 44 dan 45 cm. Jauh bos ukurannya, cuma kepake buat lap motor aja ini mah",Negative
"jelek banget, gak bisa di pakai ini mah maskernya berbulu, bisa dilihat foto tsb",Negative
Sesuai pesanan,Positive
"Selller aneh ditanya katanya uda berangkat tp tokped ga update, ternyata sepertinya memang gagal pick up, tp ga bilang yang jujur kalo paket belum dipick up malah bilangnya sudah berangkat",Negative
"Informasi produk berbeda dengan deskripsi produk yang dijual. Saran untuk yang lain, hati2lah memahami supaya tidak kecewa.",Negative
Produk Original. Efektif menyaring kotoran. Produk berfungsi dengan baik. Barang Sesuai Deskripsi.,Positive
"oke sih ini. bahannya enak buat dipakai. tebal tipisnya jg perfect buat sy, ga ketebelan ga ketipisan",Positive
Minta warna putih dikasih hijau.. Seller banyak alasan babibu..,Negative
ini kok ga ada di stand hanger pesanan saya? buat apa saya tambahin biaya,Negative
"saya kecewa banget sih,pesan maroon, hijau army sama mint.. tapi tu semua dganti sama warna lain tanpa konfirmasi., semoga bisa lebih teliti n komunikasi dg pembeli jika barang tidak tersedia..",Negative
"Barang sesuai deskripsi, recommended high quality product. Seller: packaging ok",Positive
mantap wangi nya segerrr,Positive
"pelayanan penjual nya jelek, slow respon banget",Negative
saya nyesel pake yg same day.. rugi dikirimnya lama,Negative
kurang lengkap.. eyeliner milky white nya tidak ada,Negative
"barangnya udah kami terima, terimakasih gan",Positive
"Pengiriman cepat,pesanan sesuai, packing aman,baru mau coba mbakoan next cari Bako yg rasa lain,Mtr nuwun",Positive
"bagus, angin nya terasa kuat tapi belum kebiasa ama getarannya doang yang agak kuat",Positive
"Paket sudah sampai dan sesuai dengan pesanan, remote shutter nya berfungsi dengan baik dan tidak ribet kalok mau dipakai, praktis dibawa kemana�??????",Positive
"Agak aneh aja sih seller minta ditambahin sebanyak 10x yg artinya 36rb, sedangkan di lapis hanya 2-3 lapis aja. sedangkan bubble aja 1 roll besar hanya 100rban aja. mungkin seller jualan bubble bukan jualan vga kali yaa?",Negative
Baru coba satu... Sip... Mantul.. Mudah mudahan yg satunya jg berfungsi sesuai deskripsi. Thanks Gan...,Positive
mantep om,Positive
"Barang bagus sesuai deskripsi, murah tapi gak murahan ????????????",Positive
Jelek banget mic nya. Gak nyala. Kabel cuman 50 cm. Akhirnya cuma dipake bando nya doang dan mic pake lavalier yang ada,Negative
barang bagus sesuai gambar tapi gaberwarna,Positive
"packing nya rapi bngt.... pengiriman cepat, kurirnya jg ramah ... recommended ??",Positive
"Sesuai deskripsi & pesanan. Bahan lembut, nyaman dipakai. Sesuai harga.",Positive
Respon sangat profesional dan siap membantu dng semua pertanyaan. Pengiriman sangat cepat dan kwalitas barangnya sesuai.,Positive
"Barang sudah diterima, dan kualitas brg tidak mengecewakan...... mantap abis",Positive
kualitas sesuai harganya,Positive
Udah sampenya lama bgd semingguan trs pas barangnya di coba malah patah. Sialan kan!,Negative
"SIM card ok, mudah dipasang dan mudah langsung di gunakan",Positive
"Barang tiba sudah bocor dan botol sudah kosong padahal kardus dan bubble wrap masih utuh. Jelas tutup botolnya tidak ada segel. Penjual berdalih kesalahan pada pihak ekspedisi dan harus klaim asuransi. Saya sudah lengkapi permintaan asuransi upload KTP, foto produk & video. Tapi klaim todak disetujui dan dana diteruskan ke penjual. Sangat kecewa sekelas official store servisnya seperti ini.",Negative
"brangnya ringkih baru dateng uda pecah 3 part padahal kemasan uda oke, next time di cek dlu sebelum kirim",Negative
kacamata sangat rentan. dipakai sekali patah. karena bagian karet dengan plastiknya menempel dengan kaitan kecil saja. sehingga mudah patah ..,Negative
pengiriman cepat kualitas barang bagus wanginya juga oke,Positive
"Barang sesuai deksripsi, pengiriman cepat dan rapi, terima kasih.",Positive
"diterima dalam keadaan dus terbuka... biasanya dus nya rapih tebel di packing bagus... sekarang diterima dalam keadaan dus kebuka sobek dan penyok dapet bonus tp lecek kelipet karna packing ga niat di untel2 sama barang nya, kaya ga niat ngasih... jd ga berguna bonus nya padahal bagus",Negative
"barang tidak sesuai katanya 4-5 mm ternyata tipis sekali Dan jumlahnya tidak sesuai Dari 56 pcs yg dtg 54 pcs,,kwalitas jelek",Negative
IMEI terdaftar di Kemenperin Barangnya original ?? Penjualnya ramahbanget Barangnya mulus Proses pesanan cepat Berfungsi dengan baik Packaging rapi Ada garansi iBox,Positive
"beli 2 buah, tapi hanya dikirim 1 dan dengan enaknya ngomong pengembalian dana. be careful, jangan2 memang tokonya sengaja ??",Negative
"Beli ini krn Anak & Istri mau liburan di Jakarta, cari2 ketemu toko ini dengan harga yg masih ramah kantong, untuk pelayanan toko bagus & cepet, packaging nya juga rapih & aman banget, recomended seller. Untuk Difusser nya berfungsi dengan baik, untuk kualitas diffuser nya sendiri termasuk kokoh ya dengan harga segini, puas benget sih pas udah nyobain. Semoga bisa tahan lama difusser nya",Positive
"lumayan bagus bahan a , cpt jga proses pengiriman a",Positive
aku baru pakai sebentar patah,Negative
"Beli satu stik PS2, Alhamdulillah sampai dengan keadaan baik. Bahkan packingnya pun juga pakai bubble wrap, rapi. Saat ini stik PS2nya sudah saya coba pakai selama kurang lebih 3minggu lebih, stik nya berfungsi dengan normal dan baik saja. DENGAN CATATAN saya pakai buat main game yg ringan saja. Seperti misalnya bukan game yg bertipe membutuhkan ritme kecepatan menggerakkan analog dan juga bukan menekan tombol yg keras dan berkali(Misalnya game fighting). Hanya saya gunakan buat main game bertipe casual saja. Itu saja, terimakasih.",Positive
"Percuma jg kasih buble warp dikasih brg reject pabrik, ga bs kasih pot.pula Rese",Negative
"Cocok buat bersihin layar HP yang cepat kotor karena kena keringat gara-gara main game atau dipakai telepon. Cairan pembersihnya bening dan setelah disemprotkan bentuknya jadi semacam embun gitu dan engga berbau. Bentuk alatnya compact dan sekilas mirip vape, tapi mungkin ukurannya agak awkward untuk disimpan di saku (kecil engga, besar juga engga). Pengirimannya juga cepat. Overall, puas belanja barang ini di sini.",Positive
proses & pengirimannya cepat. warna sesuai pesanan hitam doff. tapi kenapa doffnya ada yg bocel� ? jd nga sesuai ekspektasi deh ??,Negative
"bahannya bagus, seler ramah",Positive
status pesanan sudah selesai dati kemarin sore tapi ternyata produknya belum saya terima sampai hari ini,Negative
"proses kirim vouchernya cpt. cm blm check in sih. semoga ga ada masalah sampai hari h. harganya ok banget dbanding agent sejenis dan sellernya responsif, suka jadinya",Positive
"Harga tdk mahal, kualitas baik",Positive
"orng nnya responnya jutek bgt,, biasa aja kali, saya cm bertanya ga ngajak debat,, sombong bgt penjual kyak bgini...",Negative
"Seller ramah n reapon cepat, packing rapi, thanks seller..",Positive
"Barang sdh dtg packing rapih, tapi LED nya tdk nyala. Brg dtg ketika sy lg travelling pas di coba LED tdk nyala dan di hubungi tokonya tdk mau bertanggung jawab krn status order telah selesai. Selayaknya brg di test dahulu sebelum dikirim ke pembeli utk memastikan semua berfungsi!",Negative
Barang tidak sesuai dengan pesanan,Negative
"Beli 6 cuma dikirim 5, males complain ??",Negative
Ukuran sesuai. Packaging-nya rapi.,Positive
"packing nya bocor,oli kemana mana kecewa.",Negative
"Paket sudah sampai dengan selamat, pertahankan kualitas pelayanan dan harganya.. thanks seller dan tokped ..",Positive
makasiii bgtttt aku sukakkkk,Positive
butut konyol minta kuning di kasih ijo stabilo barang jelek,Negative
"barang tidak sesuai dengan pesanan..sy pesan warna hitam ukuran L di kirimnya hijau ukuran XL dan sy pesan warna hijau ukuran M di kirim nya ukuran L,, tingkat kan pelayanan bos,,semoga di pesanan berikutnya sesuai ya",Negative
Bahannya nyaman ??. Nyaman di punggung. Nyaman di punggung. Desain ergonomis. Desain ergonomis. Beban tersebar merata. Beban tersebar merata. Gampang dipakai. Gampang dipakai. Bahannya fleksibel. Penjualnya ramah banget. Proses pesanan cepat. Proses pesanan cepat. Packaging aman ??. Packaging rapi. Packaging rapi. Respon penjualnya top.,Positive
produk bisa dipakai dg baik. semoga awet. fast respon.,Positive
"pengiriman sangat lama, diluar estimasi yg tercantum",Negative
BELANJA BERTURUT TURUT 2HR.. SELLER TIDAK RAMAH.. TRAKHIR KALI BLANJA DI SINI.. NOT RECOMMENT,Negative
"salah beli gabisa dituker, pas di coba ternyata gabisa pas ditanya ini klaim garansi gimana yang bales malah bot. tai",Negative
"mantab. berfungsi dengan mantab, proses pengiriman cepat. TOP",Positive
sebelah tidak bisa diputar.,Negative
"Susah d pakainya, angin banyak yg bocor,",Negative
"Rasa tidak sesuai, gk ada kerasa daun jeruknya.BAD TASTE",Negative
bahan jelek dan kurang kokoh,Negative
gk ada plat besinya...cm ada label merk bahan,Negative
"barang sampai dengan selamat, dompet nya keren, bingkisan premium, seperti dompet mahal",Positive
alas kandang nya oke banged..tebal dan bahannya bagus..pengemasan dan pengiriman jg cepat ??????????,Positive
"barang sampe bungkusnya udh sobek, untungnya bukunya masih aman walau ujungnya sedikit rusak",Positive
"walaupun dapat saat harga flash sale, tetapi kualitas barang nya tetap bagus dan struktur nya kokoh utk smartphone pada umum nya.",Positive
Produk Original. Barang Sesuai Deskripsi. Bahan tebal. keren..,Positive
barang kurang 2 pcs yg dtg Dan kualitasnya jelek sekali Dari bahannya potongan yg g rapi Dan ketelabalan yg g sesuai 4-5 mm Di deskripsinya ternyata g sampai setebal itu,Negative
patah kaitannya gak bsa dipake deh,Negative
maaf cuma bs kasih 3 bintang. saya dpt barang yg penyok dan pelor hilang 1. respon dan pengiriman jg lambat,Negative
"ibarat bli kcing dlm karung, kainya tipis kyak kulit bwang trus nerawang bnget, pokok nya gk bgus bngt kcewa .??????",Negative
"semurah ini dan sebagus ini maaf ya telat baru ada kuota bajunya lagi dijemur,,,Ringan dipakai. Jahitannya rapi. Ukuran sesuai. Warnanya bagus ??. Bahan menyerap keringat. Tidak menerawang.",Positive
"Besar sekali ukurannya, jadi nggak kepake longgar pas saya pakai",Positive
"lumayan, biar pelayanan ala kadarnya. tapi di saat main kadang layar loss signal dari Wii console nya. trus kenapa harus beli hardisk yang begitu besar kalau isi 500game cuma 60gb",Negative
"pengiriman cepat, power banknya berfungsi baik, mudah 2 awet. mantap",Positive
"Ini seller tidak berkualitas.. Jawab lama dan barang yg dikirim tidak semua nya dan bertahap 2 x kirim..BUANG WAKTU NUNGGU.. Padahal sebelum pesan bilang ready stock... Dan ongkos kirim yg dibayar sameday ternyata dikirim berhari2 kemudian... TIDAK RECOMMENDED SELLER, JANGAN BUANG WAKTU ANDA DENGAN SELLER INI",Negative
"yg di pesan warna ngga sesuai klu memang ngga ada bilang aja ngga ada jgn bilang ada, saya ini beli bukan minta.",Negative
barang sudah diterima dalam kondisi baik. packing aman. makasi,Positive
"Bagus banget, hasilnya matte dan ga kering di bibir, di kulit gelap juga cocok. Dan tadi dicoba pake masker ga nyeplak lipstiknya. Cuma sayang warnya merahnya kurang nyala dibanding lipcream matte yg 005 impulse, tapi overall oke kok. Kalo make over keluarin warna baru lagi yang merahnya lebih nyala bakal order.",Positive
"mantap banget, recomend. barang yg diterima sesuai gambar!.",Positive
busyeettt..lamaaa amit nyampe brgnya.pdhl udh 2x order.,Negative
SERVICENYA BURUK BANGET!!!,Negative
Kendaraan menjadi kinclong kembali! Mantap!.,Positive
"dicharge lampu tidak nyala, sama sekali tidak bisa dipakai mau dikembalikan berat di ongkir HARUSNYA SEBELUM DIKIRIM DITES DULU, TOH PACKAGINYA TIDAK ADA SEGEL DITES DULU BOLEH KAYAKNYA SAYANGNYA BINTANG MINIMAL 1 NOT RECOMMEND",Negative
"TidAk jujur dan kelihatan kalau memaksakan barang terjual. Barang dikirim tidak sesuai pesanan. Dan akhirnya pembeli disuruh mengirim barang yg tidak ada solusi barang ada atau tidak, dengan resiko barang yg di foto/ ditawarkan memang sebenarnya mungkin tidak ada.",Negative
"packaging kurang rapih, semua kemasan produk BOLT sobek.. sehingga ketika unboxing, isi makanan berantakan",Negative
Ada 1 shade yg salah kirim,Negative
"harga emang ga bohong. gampang patah, jadi bagi yg kerjar kualitas tidak disarankan, tp bagi yg kejar murah silahkan...",Negative
"Produk sesuai deskripsi, packing aman terlindung, pengiriman cepat, toko/ penjual responsif, alat sudah dicoba dan berfungsi, sangat direkomendasikan.",Positive
silent dan bagus untuk pekerjaan ringan,Positive
"Rasanya gak spt biasanya. Pembelian yg ke 3 ini ASIN KEBANGETAN !!! Udah gitu packingannya cuma dibuble wrap, tdk diberi dos spt biasanya, sehingga kripiknya banyak yg hancur !!",Negative
"Recommended seller. fast respons, kualitas barang cukup, sesu�i harga. terimakasih",Positive
ngisi powerbanknya lama bgt. sampe 8 jam lebih. pas di coba charge ke hape jg lama. 4 jam lebih. lebih lama dr ngecharge ke listrik langsung.,Negative
"Ini gmn, ssd nya gak bisa di pake.... Sy minta ganti...",Negative
Sepatunya enteng. Solnya empuk. Nyaman dipakai. Ukurannya sesuai. Desainnya sporty ??. Proses pesanan cepat. Warnanya cantik. Packaging aman ??.,Positive
saya tidak pernah dikecewakan oleh toko ini. pokoknya untuk urusan videografi dan fotografi saya senang belanja di sini,Positive
jahitannya ngga rapih ..banyak benang2 yg belom kepotong.ada juga benang yang copot :'(((,Negative
saya nggak terima paketnya sama sekali saya minta lacak malah no respon,Negative
"Sudah sampai ya handuknya.Pengiriman cepat,Harga bersaing,Kualitas bagus,cocok buat Traveling atau buat ganti2.Warnanya sesuai yg diminta,cerah warnanya.proses cepat.Pengiriman pake antar aja bagus,ramah kurirnya.Terimakasih Seller,Toped dan Kurirnya ya...Salam Sehat dan Sukses yaa",Positive
Pengiriman Lama dan Mainan Gak berfungsi dengan baik,Negative
"Di kirimnya yg hidden, bukan yg semata kaki. Kecewa",Negative
"Barang -1, chat no resp",Negative
"Baju tdk sesuai dgn gambar, lebih pendek,kantong kecil seperti baju anak2",Negative
"barang sudah sampai, packing aman pke bublewrap, pengiriman cepat, pesan kmren pgi, tdi pgi udh datang lgi, kurir ramah dan langganan, terimakasih tokopedia",Positive
sangat memuaskan dan cpt smpe,Positive
"Laptop rusak, pass di aktifkan fan error, setelah di perbaiki ternyata keyboardnya rusak, setelah ganti keyboardnya ternyata adaptornya rusak. jangan belanja disini",Negative
terima kasih banyak produk bagus selalu,Positive
"pengiriman cepat, harga murah. bahan sesuai harga",Positive
Ikannya mati jadi saya kecewa ah,Negative
"BAGUUUSSSS PACKING RAPUI, CEPAT SAMPAI, TERIMAKASIH SELLER.... SUKSES SELALUU...",Positive
Beli disini puas banyak di lebihin. pngiriman cepat pokonya mantap ??,Positive
Produk sesuai pesanan,Positive
"ini pembelian kedua, tapi saya kecewa. pas beli pertama kali suka banget parfumnya makanya order lagi, tapi wanginya gak konsisten, beda sama yg sebelumnya terus kemasan jga keliatan kayak luntur gitu tulisannya, pas dipegang cat botol parfumnya luntur ke tangan",Negative
"packing rapi n aman.. produk sesuai pesanan.. seller responsif.. utk rasa dendeng ny blm dicoba ya, mdh�an saja enak.. Thanks..",Positive
dijamin asli barangnya cuma packingnya pengirimannya sederhana sekali?? sampai ada lembar soal anak sd,Positive
Padahal udah tanya sebelumnya sama penjualnya ada ga balon warna gold dama silver ? Kalo ada mau pesen balo gold sama silvernya aja 10 pcs. Yang dateng warna warni kayak gini. Sebelumnya udah chating katanya oke hufth padahal udah 2 kali beli di sini baru kali ini aku kecewa,Negative
barangnya bagus,Positive
Lancaaaaarr semuanya. Kamarnya bagus. Terimakasih banyak yaaaaa ????,Positive
"BAGUSS BGTTTT SESUAII , btw aku bli yg s013 and s008",Positive
"Barang Mendarat,,produk original sesuai dengan deskripsi,kemasan rapi ,seller Ramah,fast respon pengiriman pun cepat pokok nya recomended dah,makasih tokopedia makasih admin??",Positive
Berfungsi tapi sayangnya penyok,Positive
Bahannya adem Warnanya cantik ?? Tebalnya pas! Jahitan rapi,Positive
Koq dibungkus bubble doank tanpa kardus.. sy kan jg bayar kardus + bubble sis -_-,Negative
Matras nya ada sobek,Negative
sudah sampai dan lengkap y gan. trins,Positive
"Selalu puas dgn pelayanan seller, pengirimannya cpt dan harga kompetitif...serta mumpung lg ada update next gen",Positive
"fast respons, original, mulus, pengiriman cepat, seller ramah dan tidak sombong ???? harga tolong dimurahin lagi",Positive
"Proses pesanan dan pengiriman barang cukup cepat, produk sesuai deskripsi, seller responsif, sukses dan tetap jaga protokol kesehatan ya seller! Terima kasih.",Positive
"saat diterima tutup wajan ad yg bermasalah dan di wajannya ad goresan. bermasalahnya bukan krn proses pengiriman. tapi emang dari sononya cacat. kecewa dengan respon penjual yang bilang goresannya g masalah. Padahal saya kan beli baru, beli wajan anti gores malah terima yang bergores dan kualitas bermasalah. lgs ajukan komplain. sdh terima wajannya lagi yang tidak gores, cuma tetep bbrp yg mengecewakan. kecewa.. jadi lama dan saya harus repot ngurus pengembalian barangnya. kalau mw jual yang diskon jangan kasih yang kualitasnya g bagus. atau sampaikan aja produknya ad bbrp bermasalah makanya dikasih diskon. resiko beli online. semoga awet",Negative
"Barang baru sampe, trus dicoba, awal nya bagus, tiba tiba mesin nya mati, udah dicoba berkali kali tetap ga hidup, seller di chat tidak respon, dana sudah diterima seller, tokopedia ga bisa bantu komplain saya, kecewa sekali. Sudah 10 hari sejak komplain saya cuma disuruh nunggu katanya di cek, tiap hari saya tanya masih dicek, ga pernah sekalipun duluan kasih info soal barang saya, selalu saya yg tanya duluan, jadi kapan penyelesaian nya? Baru sekali ini belanja di tokopedia kena seller ga bagus begini, minta refund ga ditanggapi, barang saya juga ga tau kemana dan diapain, saya beli baru tapi kayak beli barang refurbish yg ga dikirim dikirim, menyebalkan!!!",Negative
Pengiriman lama sekali. Respon penjual jg lambat,Negative
"fast respon, barang bagus, recommend..",Positive
barang gak sesuai..order warna hitam polos yg dtg malah motif,Negative
"terima kasih barang sudah di terima, tapi lain kali tolong di packing yang baik, soalnya yang saya terima hanya 1/2 aja",Negative
ga ada tanggapan mau komplain...padahal saya beli bukan minta...kecewa????,Negative
"Produk nya OK..kaca bersih, karet nya OK.. Kain pembersih nya OK jg Bersihin kaca walopun di awal sudah dipasang",Positive
2nd purchase & selalu amaze sm cara mrk packing.. tebellllll n rapihhhh bngt bubble wrap nyaaaa ??????????????????,Positive
paket AMAN....TQ gan,Positive
"kecewa dengan pelayanan toko ini, Dan nyesal denga toko ini, paket lama datang, dah itu paket tidak sampai di tempat tujuan. kalau boleh saya sarankan kepada pembeli lainnya, jangan pesan lagi deh ,barang disini, mereka tidak bertanggung jawab,",Negative
"Semua kelipet yg pakai mata ayam , print an juga gak rapi , kecewa sih",Negative
Barangnya bagus dan terlihat mewah. Designya juga keren. Pengiriman cepat dan di bungkus dengan rapi,Positive
"D produk yang d jual mereknya alus shoes tp pas nyampe mereknya tumpah,, Pesennya warna cream datengnya coklat muda ??",Negative
ukurannya lebih kecil dari 40 pada umumnya. sisanya ok.,Positive
lama bgt,Negative
Proses pesanan cepat. Respon penjualnya top. Packaging rapi.,Positive
"aromanya aneh, tidak seperti lemongrass yg pernah saya beli",Negative
"Produk ini, chip di dalamnya didaur ulang dan dipasang kembali setelah menggiling kata-kata aslinya. Pembeli harap perhatikan Teman-teman, tolong beri perhatian khusus",Negative
Barang diterima dengan kondisi pinggirannya patah...,Negative
"Mentang2 beli 1 buat ngepasin uang kenapa dikasih nya dlm kondisi bekas ya? Ga ada perekat sama sekali dan ada bekas lekukan juga. Iya murah, cuman harus profesional dong jualannya..",Negative
masa baru dateng langsung rusak,Negative
Barang kaga di kirim . Buat yg belanja banyak lebih teliti karena barang pasti ada yg kaga di kirim 1 item dari total belanja .pelajaran buat saya karena gak teliti .dan yg punya lapak juga gak ada solusi rugi 20k an gpp,Negative
"Paking barangnya kurang bagus,nyampe barang,adaptor didalam udah pecah.sampe sekarang belum bisa dicoba.",Negative
"Yg sebelah kanan ga bisa pas di telinga, udh dicoba 4 org,,hasilx sama ga bisa pas jadi dengarx ga maksimal",Negative
"Salah kirim produk, admin lama banget balesnya. Proses retur gak jelas",Negative
No good !!! Tidak puassss,Negative
Fitting tidak sesuai dgn celana pendek umumnya.,Negative
"susah payah narik balonnya biar mekar, eh bolong...",Negative
ukurannya gak sesuai deskripsi gk ada 30cm dan juga gk 2m.. parah sih beli 2 produk berbesa tapi gk rata semua potongannya..,Negative
"Enakkkk banget, cryyyyy! Packaging oke. Tengkyu!",Positive
packaging nya cuma plastik item itupun sobek pas baru diterima,Negative
Barangnya mulus..,Positive
